title,image,describe,category,ID
MELLTORP / KÄTTIL,C:\Users\admin\Downloads\app_30688142\melltorp-kaettil-table-and-2-chairs-white-knisa-light-grey__1016370_pe830348_s5.jpg,"Small, neat dimensions make the table easy to furnish with, even when space is limited.The chair cover comes in one piece and fixes in place with hook-and-loop fasteners so you can easily pull it off and put it back on again.After lively meals, it's nice to know that you can easily pull the chair cover off and machine wash it.The seat and high back are padded with foam and dressed in a durable, yet soft and smooth fabric cover to make your time around the table comfy and enjoyable, so you can stay a while longer.The armless silhouette allows you to push these chairs right up to your table and save on floor space.With regular airing or washing, you keep your cover fresh and clean, and also reduce the amount of dust and dirt in your living space.Sturdy and durable solid wood chair frame.",chair,00412
INGOLF,C:\Users\admin\Downloads\app_30688142\ingolf-chair-white__1082704_pe858783_s5.jpg,none,chair,00413
SANDSBERG / ÖSTANÖ,C:\Users\admin\Downloads\app_30688142\sandsberg-oestanoe-table-and-4-chairs-black-black-remmarn-dark-grey__1328464_pe944799_s5.jpg,"You can sit comfortably for a long time at the table since the angle of the backrest provides good lumbar support.Sturdy metal table frame and durable, smooth melamine tabletop.A slim design that blends in without taking up too much visual space in the room, yet sturdy enough to hold up to everyday activities.The chair stands firmly in place thanks to the metal underframe.",chair,00414
HOLMSTA,C:\Users\admin\Downloads\app_30688142\holmsta-armchair-handmade-beige__1086020_pe860308_s5.jpg,"The material brings a piece of nature into your home and spreads a calm, warm feeling.The handmade, flexible rattan weave with beautiful details makes the armchair just as decorative as functional.Made of rattan, bamboo and acacia wood – natural materials that age beautifully and acquire their own unique character over time.You sit really comfortably thanks to the armchair's softly shaped armrests and backrest.",chair,00415
SALNÖ / GRYTTOM,C:\Users\admin\Downloads\app_30688142\salnoe-gryttom-armchair-with-cushion__1224551_pe915022_s5.jpg,"Furniture made of natural fibre is lightweight, yet sturdy and durable.Rattan is a natural material which ages beautifully and develops its own unique character over time.You sit really comfortably thanks to the armchair's softly shaped armrests and backrest.The polyester filling keeps its shape and makes the seat softer while your head enjoys nice support.The headrest cushion is attached and held in place with a hook-and-loop fastener.Easy to keep fresh since the cover is removable and can be washed.",chair,00416
VASSHOLMEN,C:\Users\admin\Downloads\app_30688142\vassholmen-chair-in-outdoor-black-white__1078039_pe857074_s5.jpg,"Handmade by skilled craftspeople, which makes every product unique.Your body sits softly and comfortably thanks to the resilient plastic rattan and the shaped seat.You’re happy to sit and linger on this chair for a long time while enjoying good food and beverages outdoors. Just like at a French bistro, but at home.The timeless graphic pattern on the seat and back is woven by hand from artificial rattan and is matched by the black-white details around the legs of the chair.Gives you more time to enjoy the outdoors since all materials are weather-resistant, durable and easy-care.DesignerJon Karlsson",chair,00417
FRYKSÅS,C:\Users\admin\Downloads\app_30688142\fryksas-armchair-and-footstool-rattan-risane-natural__1364902_pe956118_s5.jpg,"Furniture made of natural fibre is lightweight, yet sturdy and durable.Easy to assemble.Rattan is a natural material which ages beautifully and develops its own unique character over time.The material brings a piece of nature into your home and spreads a calm, warm feeling.You sit really comfortably thanks to the armchair's softly shaped armrests and backrest.The neutral colour of the cushion complements the warm expression of the rattan chair and the beautiful handmade shapes.The polyester filling keeps its shape and makes your seat softer and more comfortable.The pieces of furniture in the FRYKSÅS series match each other. Combine them as you like or use them as solitaires.",chair,00418
LANEBERG / EKEDALEN,C:\Users\admin\Downloads\app_30688142\laneberg-ekedalen-table-and-4-chairs-white-white-light-grey__0754618_pe747985_s5.jpg,"It’s quick and easy to change the size of the table to suit your different needs. With the extra leaf stored under the table top you can extend the table to seat from 4 to 6 people.1 person can quickly and smoothly extend the table before the guests arrive.Solid wood underframe makes the construction very sturdy.The dining table will bring a sense of nature to your dining space. The tones of a rustic white finish let the beauty of the wood grains shine.After the meal you can hide the extension leaf under the table – giving a top a smooth, seamless surface.The upholstered seat and comfortable angle of the backrest make the chair perfect for long dinners.The cover is easy to remove, machine-wash and put back on again.You can choose from several different seat covers and switch between them when you like.DesignerEhlén Johansson/K Hagberg/M Hagberg",chair,00419
BERGMUND,C:\Users\admin\Downloads\app_30688142\bergmund-chair-black-glose-black__0817914_pe774169_s5.jpg,"Durable coated split leather with a protective finish which you can easily wiped clean with a damp cloth.The chair legs are made of solid wood, which is a durable natural material.Soft, hardwearing and easy care leather, which ages gracefully.You can sit comfortably for a long time. The angle of the back rest provides good lumbar support. The backrest angle combined with the upholstered seat make the chair perfect for long dinners.DesignerK Hagberg/M Hagberg",chair,00420
SVENARNE,C:\Users\admin\Downloads\app_30688142\svenarne-chair-tallmyra-white-black__0709578_pe726999_s5.jpg,"You sit comfortably thanks to the high back.The upholstered seat and comfortable angle of the backrest make the chair perfect for long dinners.TALLMYRA is a hardwearing chenille cover made of cotton and polyester and has a soft surface and a slightly reflective lustre.Dine in style and comfort. This upholstered chair is perfect for long meals, spending precious moments with family and friends or for indulging in some relaxing me-time.DesignerK Hagberg/M Hagberg",chair,00421
PINNTORP / PINNTORP,C:\Users\admin\Downloads\app_30688142\pinntorp-pinntorp-table-and-2-chairs-light-brown-stained-white-stained-katorp-light-brown-stained__1118116_pe872937_s5.jpg,"You sit comfortably thanks to the padded seat.The foldable leaf automatically locks into position. The safety lock is released with a simple pull.This drop-leaf table seats 2-4. It is a good option for small spaces as the size can be adjusted easily, according to need.The armless silhouette allows you to push these chairs right up to your table and save on floor space.Sturdy and durable solid wood chair frame.",chair,00422
POÄNG,C:\Users\admin\Downloads\app_30688142\poaeng-armchair-white-stained-oak-veneer-glose-dark-brown__0681511_pe720123_s5.jpg,"A range of various seat cushions makes it easy to change the look of your POÄNG and your living room.Soft, hardwearing and easy care leather which is practical for families with children.The high back gives good support for your neck.Layer-glued bent oak gives comfortable resilience.10-year guarantee for POÄNG armchair frame. Read about the terms in the guarantee brochure.The fabric back side allows air to pass through and acts as a pressure equalizer, enabling the cushion to shape itself to your body when you sit down.",chair,00423
EKEDALEN / EKEDALEN,C:\Users\admin\Downloads\app_30688142\ekedalen-ekedalen-table-and-4-chairs-dark-brown-ramna-light-grey__0737704_pe741220_s5.jpg,"Every table is unique, with varying grain pattern and natural colour shifts that are part of the charm of wood.The smart design means that the table top has no seams when you use the table without extending it.The table legs are always in the corners of the table top even when the table is extended, so there is plenty of room for chairs under the table.1 person can quickly and smoothly extend the table before the guests arrive.DesignerEhlén Johansson",chair,00424
MÖRBYLÅNGA / MÅRENÄS,C:\Users\admin\Downloads\app_30688142\moerbylanga-marenaes-table-and-4-chairs-with-armrests-oak-veneer-brown-stained-black-gunnared-beige__1198495_pe904102_s5.jpg,"The table has a full plank design that gives it an authentic plank expression with a genuine wood feeling.Every table is unique, with varying grain pattern and natural colour shifts that are part of the charm of wood.Oak is an exceedingly strong and durable hardwood with a prominent grain. It darkens beautifully with age acquiring a golden-brown undertone.Extra covers to alternate with mean it's easy to give both your chair and room a new look.The chair cover is easy to keep clean as it is removable and can be machine washed.",chair,00425
STRANDTORP / BERGMUND,C:\Users\admin\Downloads\app_30688142\strandtorp-bergmund-table-and-6-chairs-white-ramna-light-grey__1057135_pe848781_s5.jpg,"You can easily change the size of this 3-in-1 table to seat 4, 6 or 8 persons using the included self-storing leaves. If you add a seat to each short side you can even fit up to 10 persons.The 2 self-storing leaves are easy to insert to extend the table and just as easy to remove and tuck away under the table top when your guests have gone home.The white table top has a top layer of foil for durability and a smooth, flawless look.The table legs and underframe are made of sturdy, durable powder-coated steel.Thanks to new research and a new technique, the upholstered chair gives you optimal seating comfort. Change the style anytime by replacing the chair cover with one in a different colour or model.The upholstery of the chair consists of straight polyester fibres with small gaps between them – providing comfy elasticity and better ventilation so you enjoy a pleasant temperature when sitting.The seat's bowl-shaped bottom is adapted for your sit bones and those of most of the world's population. And with an innovative technique, the seat's padding is shaped to maximise your comfort.The cover is easy to keep clean as it is removable and can be washed.The backrest has a built-in lumbar support and the angle between the seat and the backrest is optimally adapted to make it comfortable for you to sit a little longer at the dining table.ORRSTA cover is woven from cotton and polyester with a light structure that makes it soft and comfortable. The yarn-dyed fabric has a tone-on-tone effect and a clean and calm look.",chair,00426
LÄKTARE,C:\Users\admin\Downloads\app_30688142\laektare-conference-chair-birch-veneer-white__1188525_pe899485_s5.jpg,"Suitable for business use.Save space when the chairs are not in use. Stack up to 5 chairs with fabric cover, or 7 chairs without the cover.Lightweight and easy to move or re-arrange according to the needs of your meetings.Rubber armrests keep the chair in place when you hang it over the tabletop for easy cleaning of floors. The darker colour conceals dirt that comes from frequent use.Armrests provide support for the upper part of your forearms and reduce strain on the back and shoulders during long meetings.The lumbar support helps maintain the correct posture while sitting which reduces strain on muscles on your lower back.The soft plate underneath the chair seat prevents scratching on the seat surface when the chairs are stacked.Create a colour-coordinated office. Use chair covers with different colours for different meeting and work areas.LÄKTARE conference chair pairs up perfectly with LÅNGFJÄLL conference chair and HATTEFJÄLL office chair.Shorter armrests allow you to sit closer to the table for a better posture. Also, you do not have to push it out as far when getting up from the chair.Rubber chair feet protect the floor and reduce noise from moving chairs.10 year guarantee. Read about the terms in the guarantee brochure.",chair,00427
NORDVIKEN / KÄTTIL,C:\Users\admin\Downloads\app_30688142\nordviken-kaettil-table-and-2-chairs-black-knisa-dark-grey__1016373_pe830357_s5.jpg,"This drop-leaf table seats 2-4. It is a good option for small spaces as the size can be adjusted easily, according to need.The chair cover comes in one piece and fixes in place with hook-and-loop fasteners so you can easily pull it off and put it back on again.After lively meals, it's nice to know that you can easily pull the chair cover off and machine wash it.The seat and high back are padded with foam and dressed in a durable, yet soft and smooth fabric cover to make your time around the table comfy and enjoyable, so you can stay a while longer.The armless silhouette allows you to push these chairs right up to your table and save on floor space.With regular airing or washing, you keep your cover fresh and clean, and also reduce the amount of dust and dirt in your living space.Sturdy and durable solid wood chair frame.",chair,00428
DUVSKÄR,C:\Users\admin\Downloads\app_30688142\duvskaer-chair-in-outdoor-black-blue__1138802_pe880082_s5.jpg,"The materials in this outdoor furniture require minimal maintenance.The chair can be stacked, which helps you save space.Holes in seat and backrest allow for air ventilation and let water drain away.Can be used both indoors and outdoors, and is just as suitable on the balcony as in the kitchen or hallway.DesignerMikael Axelsson",chair,00429
NORBERG / KÄTTIL,C:\Users\admin\Downloads\app_30688142\norberg-kaettil-table-and-2-chairs-white-knisa-light-grey__1016372_pe830350_s5.jpg,"Table top covered with melamine, which gives a hard-wearing, easy clean finish.Becomes a practical shelf for small things when folded down.",chair,00430
YNGVAR,C:\Users\admin\Downloads\app_30688142\yngvar-chair-anthracite__0714279_pe730013_s5.jpg,"You can stack the chairs, so they take less space when you're not using them.You sit comfortably thanks to the generous size and the soft rounded shape of the seat and back support.Hang the chair on the table to clear the floor space for easy cleaning.You can push the chairs under the table or stack up to 5 chairs to save space when they are not in use.The clear lacquered surface is easy to clean and maintain.DesignerIKEA of Sweden",chair,00431
SALNÖ / GRYTTOM,C:\Users\admin\Downloads\app_30688142\salnoe-gryttom-chair-with-cushion-armrests-rattan-gransel-natural__1342528_pe949050_s5.jpg,"The cover is easy to keep clean as it is removable and machine washable.Hand-woven by experienced craftspeople, which makes each chair unique with their rounded shapes and detailed patterns.Rattan is a natural material which ages beautifully and gains its own unique character over time.The material brings a piece of nature into your home and spreads a calm, warm feeling.",chair,00432
NORBERG / KÄTTIL,C:\Users\admin\Downloads\app_30688142\norberg-kaettil-table-and-2-chairs-white-knisa-light-grey__1090863_pe862184_s5.jpg,"Table top covered with melamine, which gives a hard-wearing, easy clean finish.This wall-hung table seats up to 2 people comfortably and has adjustable shelves where you can keep your everyday essentials nearby.The clean and simple design fits in most settings and lets the details you choose to fill it with speak for themselves.Folded down, the unit takes up no floor space and the storage compartment is always accessible.The storage compartment with moveable shelves is practical for keeping tableware, desk accessories, chargers or decorative items handy. 1 shelf is equipped with holders for plates, books or similar.The small moveable tray holds pencils, cutlery or other small items.Hang towels or headphones on the hooks on the sides.3 shelves and storage tray are made of powder-coated light-weight metal.The shelf with holder is made of beech which is ideal for storing sensitive materials such as plates or tablets and it adds warmth to the design.",chair,00433
PINNTORP / PINNTORP,C:\Users\admin\Downloads\app_30688142\pinntorp-pinntorp-table-and-4-chairs-light-brown-stained-white-stained-katorp-light-brown-stained__1118124_pe872942_s5.jpg,"Small, neat dimensions make the table easy to furnish with, even when space is limited.You sit comfortably thanks to the padded seat.The cover is easy to keep clean as it is removable and can be washed.The armless silhouette allows you to push these chairs right up to your table and save on floor space.With regular airing or washing, you keep your cover fresh and clean, and also reduce the amount of dust and dirt in your living space.Sturdy and durable solid wood chair frame.",chair,00434
MARIEDAMM / KARLPETTER,C:\Users\admin\Downloads\app_30688142\mariedamm-karlpetter-table-and-4-chairs-black-marble-effect-gunnared-medium-grey-black__1329932_pe945304_s5.jpg,none,chair,00435
TÄRNÖ,C:\Users\admin\Downloads\app_30688142\taernoe-table-2-chairs-outdoor-black-light-brown-stained-kuddarna-beige__0666808_pe713691_s5.jpg,"Ties keep the cushion firmly in place on the chair.The cushion has a longer life, since it can be turned over and used on both sides.For added durability and so you can enjoy the natural expression of the wood, the furniture has been pre-treated with a layer of semi-transparent wood stain.The chair and the table take little room to store as they fold flat.DesignerIKEA of Sweden",chair,00436
VINGSÖN,C:\Users\admin\Downloads\app_30688142\vingsoen-wing-chair-in-outdoor-grey-jaerpoen-duvholmen-anthracite__1078906_pe857321_s5.jpg,"You can just shake off water from a light rain, as the cushion cover is water repellent.For added durability and so you can enjoy the natural expression of the wood, the furniture has been pre-treated with a layer of semi-transparent wood stain.The colour stays fresh for longer, as the fabric is highly resistant to fade thanks to the good lightfastness.The flexible textile rope weave combined with the comfortable cushions makes the armchair soft and cosy to sit on.Here you can relax and enjoy since the wing chair’s high back embraces you and creates a cocoon-like feeling while giving your head and neck comfortable support.The decorative textile rope weave and the fabric covered cushions, together with the slender wooden legs, give the armchair an expression that goes just as well outdoors as indoors.",chair,00437
HAVSTEN,C:\Users\admin\Downloads\app_30688142\havsten-armchair-outdoor-beige-beige__0787965_pe763433_s5.jpg,"Easy to keep clean since the cushion cover can be removed and washed.The cushion has a longer life, since it can be turned over and used on both sides.You can just shake off water from a light rain, as the cushion cover is water repellent.The cushion covers are dope dyed, a process that reduces consumption of water and dyestuff while improving colour fastness compared to traditional dyeing techniques.In HAVSTEN you sit deep, low and soft with a comfortable resilience thanks to the elastic mesh in the bottom.",chair,00438
SKANSNÄS / TOSSBERG,C:\Users\admin\Downloads\app_30688142\skansnaes-tossberg-table-and-4-chairs-light-beech-veneer-white-gunnared-beige__1298574_pe936246_s5.jpg,"Each table is unique, with varying grain patterns and natural colour shifts that are part of the charm of wood.A statement piece for your dining area with fine details like solid wood edges, breadboard ends with cross-grain pattern and smooth, rounded corners.Self-storing butterfly extension leaf. The hidden leaf easily extends seating from 4 to 6 in seconds, with only one pair of hands needed.Light-stained in layers and clear lacquered for protection and wear resistance. The tabletop is made with extra thick veneer so you can enjoy gatherings with less worries about stains and wear.The dope-dyeing process reduces consumption of water and dyestuff while improving colour fastness compared to traditional dyeing techniques.Extra comfy chair thanks to the high resilience foam that gives an instant, supportive and flexible feeling.With armrests so you can relax and linger longer at the table.The chair cover is made of dope-dyed Gunnared fabric in polyester. It is a durable fabric with a wool-like feel, a warm look and a two-toned melange effect.",chair,00439
STRANDTORP / BERGMUND,C:\Users\admin\Downloads\app_30688142\strandtorp-bergmund-table-and-8-chairs-white-ramna-light-grey__1057192_pe848784_s5.jpg,"You can easily change the size of this 3-in-1 table to seat 4, 6 or 8 persons using the included self-storing leaves. If you add a seat to each short side you can even fit up to 10 persons.The 2 self-storing leaves are easy to insert to extend the table and just as easy to remove and tuck away under the table top when your guests have gone home.The white table top has a top layer of foil for durability and a smooth, flawless look.The table legs and underframe are made of sturdy, durable powder-coated steel.Thanks to new research and a new technique, the upholstered chair gives you optimal seating comfort. Change the style anytime by replacing the chair cover with one in a different colour or model.The upholstery of the chair consists of straight polyester fibres with small gaps between them – providing comfy elasticity and better ventilation so you enjoy a pleasant temperature when sitting.The seat's bowl-shaped bottom is adapted for your sit bones and those of most of the world's population. And with an innovative technique, the seat's padding is shaped to maximise your comfort.The cover is easy to keep clean as it is removable and can be washed.The backrest has a built-in lumbar support and the angle between the seat and the backrest is optimally adapted to make it comfortable for you to sit a little longer at the dining table.ORRSTA cover is woven from cotton and polyester with a light structure that makes it soft and comfortable. The yarn-dyed fabric has a tone-on-tone effect and a clean and calm look.",chair,00440
JANINGE,C:\Users\admin\Downloads\app_30688142\janinge-bar-stool-white__0728069_pe736042_s5.jpg,You sit comfortably thanks to the scooped seat.A special surface treatment makes the seat extra scratch resistant.Easy to adjust in heights with only one hand.With footrest for relaxed sitting posture.DesignerJohn/Jonas/Petrus/Paul/Caroline,chair,00441
EKEDALEN / EKEDALEN,C:\Users\admin\Downloads\app_30688142\ekedalen-ekedalen-table-and-6-chairs-dark-brown-dark-brown-ramna-light-grey__1097431_pe864942_s5.jpg,"The extra leaf can be stored within easy reach under the table top.Every table is unique, with varying grain pattern and natural colour shifts that are part of the charm of wood.The smart design means that the table top has no seams when you use the table without extending it.The table legs are always in the corners of the table top even when the table is extended, so there is plenty of room for chairs under the table.1 person can quickly and smoothly extend the table before the guests arrive.",chair,00442
FRYKSÅS,C:\Users\admin\Downloads\app_30688142\fryksas-armchair-with-cushion-rattan-risane-natural__1289334_pe934382_s5.jpg,"Lightweight; easy to lift and move.Furniture made of natural fibre is lightweight, yet sturdy and durable.Easy to assemble.Rattan is a natural material which ages beautifully and develops its own unique character over time.The material brings a piece of nature into your home and spreads a calm, warm feeling.You sit really comfortably thanks to the armchair's softly shaped armrests and backrest.The neutral colour of the cushion complements the warm expression of the rattan chair and the beautiful handmade shapes.The polyester filling keeps its shape and makes your seat softer and more comfortable.",chair,00443
LILLEHEM,C:\Users\admin\Downloads\app_30688142\lillehem-armchair-with-side-table-gunnared-brown-red-wood__1328723_pe944927_s5.jpg,"The cover is easy to keep clean since it can be machine washed and is easy to take off and put on again.10-year guarantee. Read about the terms in the guarantee brochure.This cover is made of dope-dyed Gunnared fabric in polyester. It is a durable fabric with a wool-like feel, a warm look and a two-toned melange effect.The modules look equally nice from all sides so you can place your sofa along the wall or in the middle of the room.Combine the modules as you like and adapt your LILLEHEM sofa to your needs, activities and space – with generous seating for many or a smaller solution without armrests in tight spaces.Suits just as well as a large seating solution in a business space as in your living room at home. The stylish expression blends into many different contexts.A flexible solution that you can always update, expand and change if conditions shift.The seat cushion is made with foam and zigzag springs that provide supportive comfort when sitting or lying down. The generous backrest is comfy for both back and lumbar.Suitable for business use.You can complete your sofa with TUNSTA table, placing it as a separate coffee table or as an integrated side table to create a complete solution that suits your needs.",chair,00444
