title,image,describe,category,ID
UTESPELARE,C:\Users\admin\Downloads\app_30688142\utespelare-gaming-chair-bomstad-grey__0985643_pe816715_s5.jpg,"The safety castors have a pressure-sensitive brake mechanism that keeps the chair in place when you stand up, and releases automatically when you sit down.You sit comfortably since the chair is adjustable in height.This desk chair has adjustable tilt tension that allows you to adjust the resistance to suit your movements and weight.The synchronised seat and back tilt follows your body movements and adjusts the chair to the correct position.The design of the high backrest gives your body, neck and head a sturdy and comfortable support.You easily adjust the height of the chair and the tilt of the back with one hand.On the back of the backrest there is a pocket where you can put things you want close at hand when playing.The leather-like upholstery is durable and easy to wipe clean.Goes well with the matching UTESPELARE gaming desk.DesignerJon Karlsson",chair,00272
LINNEBÄCK,C:\Users\admin\Downloads\app_30688142\linnebaeck-easy-chair-ramna-olive-green__0951669_pe801313_s5.jpg,"10 year guarantee. Read about the terms in the guarantee brochure.LINNEBÄCK easy chair has a light, airy look and a low weight, which makes it simple to move around. Combine with other furniture and use in different situations and places at home.The powder-coated metal frame and cover are durable and easy to care for, making the easy chair a casual and flexible piece of furniture that you can enjoy for a long time.The cover in a muted pastel tone adds a visual calmness to the room and is easy to match with other decor.DesignerJonas Hultqvist",chair,00273
STRANDMON,C:\Users\admin\Downloads\app_30688142\strandmon-armchair-and-footstool-tallmyra-dark-green__1123177_pe874723_s5.jpg,"10 year guarantee. Read about the terms in the guarantee brochure.This cover is made of Tallmyra, a durable and soft fabric with a slight texture.This wing chair and footstool are the perfect combination when you want to stretch out, rest your feet and sit extra comfortably and relaxed.You can easily move the footstool around to wherever you need it and use it as an extra seat, for example when you have friends visiting.The wing chair has a high back which provides extra support for your neck, so that you can lean your head back when resting.Round armrests, soft lines and an inviting upholstery give this wing chair a soft embracing feel.",chair,00274
POÄNG,C:\Users\admin\Downloads\app_30688142\poaeng-armchair-white-stained-oak-veneer-knisa-light-beige__0681526_pe720135_s5.jpg,"To sit even more comfortably and relaxed, you can use the armchair together with POÄNG footstool.A range of various seat cushions makes it easy to change the look of your POÄNG and your living room.The high back gives good support for your neck.Layer-glued bent oak gives comfortable resilience.10 year guarantee. Read about the terms in the guarantee brochure.DesignerIKEA of Sweden/Noboru Nakamura",chair,00275
PELLO,C:\Users\admin\Downloads\app_30688142\pello-armchair-holmby-natural__38296_pe130209_s5.jpg,PELLO armchair has a bent shape that is slightly resilient when you’re seated and provides comfortable back and neck support.A lightweight and airy armchair with a clean design that fits everywhere and helps you create comfortable seating throughout the home.The natural colours and materials create a bright and fresh expression in your home.10 year guarantee. Read about the terms in the guarantee brochure.DesignerIKEA of Sweden,chair,00276
ENSHOLM,C:\Users\admin\Downloads\app_30688142\ensholm-chair-green-outdoor__1236722_pe917719_s5.jpg,"You sit comfortably and relaxed, since ENSHOLM chair has a breathable fabric that adapts to your body shape and temperature.You can easily stack the lightweight chairs, so they take less space when you're not using them.Enhance your outdoor decor with this chair’s stylish green color that suits any garden and patio setting.DesignerGio Tirotto",chair,00277
AGEN,C:\Users\admin\Downloads\app_30688142\agen-chair-rattan-bamboo__31428_pe120743_s5.jpg,Handwoven; each piece of furniture is unique.Stackable chair; saves space when not in use.Plastic feet; protect the furniture if in contact with a moist surface.Rattan is a natural material which ages beautifully and develops its own unique character over time.,chair,00278
LISABO,C:\Users\admin\Downloads\app_30688142\lisabo-chair-ash__0786549_pe763015_s5.jpg,"Ash is a strong hardwood material with a beautiful grain pattern.  As it ages the colour deepens moderately towards a deep straw colour.A sturdy chair that is well-suited for all types of activities around the table.Ash-veneer and solid birch creates a warm, natural feeling in your room.For a coordinated look, combine with other ash-veneer finish products in the LISABO series.For a softer seat or to add a personal touch to the room, complete with a chair pad in the style and colour of your choice.DesignerK Hagberg/M Hagberg",chair,00279
SKÅLBODA,C:\Users\admin\Downloads\app_30688142\skalboda-armchair-black__1180834_pe896474_s5.jpg,10-year guarantee. Read about the terms in the guarantee brochure.Part of the Nytillverkad collection where several IKEA classics have been given a new look.Designed by Niels Gammelgaard in 1983  – a timeless classic that feels just as modern now as it did then.DesignerNiels Gammelgaard,chair,00280
STOCKHOLM,C:\Users\admin\Downloads\app_30688142\stockholm-chair-walnut-idhult-black__0753719_pe747693_s5.jpg,"You sit comfortably thanks to the padded seat.The softly curved back, armrests and walnut veneer together give the chair a warm and welcoming look.You can easily find your own favourite position thanks to the chair's generous design.Each chair has a unique expression since the stable construction is made of solid wood and veneer – living materials with natural shifts in colour and grain.",chair,00281
SANDSBERG,C:\Users\admin\Downloads\app_30688142\sandsberg-chair-black-brown-stained__1068130_pe852977_s5.jpg,"Plastic feet protect your floor against scratching.For a softer seat or to add a personal touch to the room, complete with a chair pad in the style and colour of your choice.A slim design that blends in without taking up too much visual space in the room. Lightweight yet sturdy enough to hold up to everyday activities.The 2-slat backrest is shaped and bent to give a flexible feeling when you lean against it.A perfect match with SANDSBERG table.DesignerK Hagberg/M Hagberg",chair,00282
FLINTAN,C:\Users\admin\Downloads\app_30688142\flintan-office-chair-with-armrests-black__1007241_pe825960_s5.jpg,"10 year guarantee. Read about the terms in the guarantee brochure.The castors are rubber coated to run smoothly on any type of floor.The cover is easy to keep clean as it is removable and machine washable.The high backrest and the curved shape of the chair, provide good lower back support and prevent your back from getting tired. You sit comfortably, longer and with a relaxed posture.Increased stability since the tilt function is lockable when the backrest is in the upright position.Suitable for business use.This ergonomic office chair has lots of functions that allow you to easily adapt the chair to your body.Synchronised tilt mechanism allows the chair to move with you. The backrest moves more than the seat when you lean back, so torso/hips open up. This improves circulation and keeps energy levels up.Height-adjustable seat allows you to adjust the height so that back and legs are at a 90° angle.A safety function locks the castors when no one is sitting in the chair and keeps it securely in place when you stand up.The castors are designed to provide ease of movement and maneuverability on both carpeted and hard floors as well as on uneven surfaces.Armrests provide support for the upper part of your forearms and reduce strain on the back and shoulders during long meetings.With automatic tilt tension, your body weight determines how much resistance the backrest offers. This counter-pressure helps you keep an active posture in your chair.As you recline, the synchronised tilt mechanism allows feet to stay on the floor while your gaze remains straight ahead. Your chest stretches without adding pressure on thighs, improving circulation.",chair,00283
ÖRFJÄLL,C:\Users\admin\Downloads\app_30688142\oerfjaell-childrens-desk-chair-white-vissle-pink__0708525_pe726625_s5.jpg,"High-quality density foam will keep the chair comfortable for many years to come.You sit comfortably since the chair is adjustable in height.The safety castors have a pressure-sensitive brake mechanism that keeps the chair in place when you stand up, and releases automatically when you sit down.Height adjustable children's desk chair which you can swivel to the desired height.DesignerS Holmbäck/U Nordentoft",chair,00284
EKEDALEN,C:\Users\admin\Downloads\app_30688142\ekedalen-chair-white-ramna-light-grey__0728310_pe736178_s5.jpg,The cover is easy to keep clean as it is removable and machine washable.The upholstered seat and comfortable angle of the backrest make the chair perfect for long dinners.Solid wood chair frame makes the construction durable and very sturdy.Easy to combine with tables and benches in the same series.DesignerEhlén Johansson,chair,00285
LANDSKRONA,C:\Users\admin\Downloads\app_30688142\landskrona-armchair-gunnared-dark-grey-wood__0602087_pe680155_s5.jpg,"Seat cushions filled with high-resilience foam and polyester fibre wadding provide great seating comfort.10 year guarantee. Read about the terms in the guarantee brochure.The fabric cover has a warm and welcoming look, while the tight fit gives the armchair a neat and stylish expression.DesignerIKEA of Sweden/Tord Björklund",chair,00286
BROBOCK,C:\Users\admin\Downloads\app_30688142\brobock-armchair-rattan__1200167_pe904865_s5.jpg,"The armchair is lightweight and easy for your child to move on their own.The handmade, flexible rattan weave with beautiful details makes the armchair just as decorative as functional.The material brings a piece of nature into your home and spreads a calm, warm feeling.You sit really comfortably thanks to the armchair's softly shaped armrests and backrest.Rattan is a natural material which ages beautifully and develops its own unique character over time.DesignerMonika Mulder",chair,00287
KÄTTIL,C:\Users\admin\Downloads\app_30688142\kaettil-chair-black-knisa-dark-grey__1016337_pe830330_s5.jpg,"The chair cover comes in one piece and fixes in place with hook-and-loop fasteners so you can easily pull it off and put it back on again.After lively meals, it's nice to know that you can easily pull the chair cover off and machine wash it.The seat and high back are padded with foam and dressed in a durable, yet soft and smooth fabric cover to make your time around the table comfy and enjoyable, so you can stay a while longer.With regular airing or washing, you keep your cover fresh and clean, and also reduce the amount of dust and dirt in your living space.Sturdy and durable solid wood chair frame.The armless silhouette allows you to push these chairs right up to your table and save on floor space.DesignerIKEA of Sweden",chair,00288
FLINTAN,C:\Users\admin\Downloads\app_30688142\flintan-office-chair-black__1007236_pe825956_s5.jpg,"10 year guarantee. Read about the terms in the guarantee brochure.Armrests are available as an extra option to relieve strain on your arms and shoulders.The castors are rubber coated to run smoothly on any type of floor.The high backrest and the curved shape of the chair, provide good lower back support and prevent your back from getting tired. You sit comfortably, longer and with a relaxed posture.Increased stability since the tilt function is lockable when the backrest is in the upright position.The cover is easy to keep clean and fresh, as you can take it off and machine-wash it.Suitable for business use.This ergonomic office chair has lots of functions that allow you to easily adapt the chair to your body.Synchronised tilt mechanism allows the chair to move with you. The backrest moves more than the seat when you lean back, so torso/hips open up. This improves circulation and keeps energy levels up.Height-adjustable seat allows you to adjust the height so that back and legs are at a 90° angle.A safety function locks the castors when no one is sitting in the chair and keeps it securely in place when you stand up.The castors are designed to provide ease of movement and maneuverability on both carpeted and hard floors as well as on uneven surfaces.With automatic tilt tension, your body weight determines how much resistance the backrest offers. This counter-pressure helps you keep an active posture in your chair.As you recline, the synchronised tilt mechanism allows feet to stay on the floor while your gaze remains straight ahead. Your chest stretches without adding pressure on thighs, improving circulation.",chair,00289
EKOLSUND,C:\Users\admin\Downloads\app_30688142\ekolsund-recliner-gunnared-light-brown-pink__0709905_pe727164_s5.jpg,"You can set this reclining armchair in 3 positions – upright, lean back and full recline – making it easy to adapt to various activities at home.Easy to bring home in 3 packages ― and is assembled and disassembled in a few simple steps.The cover is easy to keep clean since it is removable and can be machine washed, while the perfect fit makes it look just as neat as a fixed cover.The footrest folds out from the seat without leaving a gap, so you can rest safely without any risk of children’s fingers getting caught in the chair.The back cushion has a chambered construction, designed to adjust to your body and provide maximum support to your lumbar and neck.The seat cushion is filled with polyurethane foam that provides a soft comfort and an embracing feeling.The cushions are wrapped in polyester wadding to keep their comfort and neat shapes when used.10 year guarantee. Read about the terms in the guarantee brochure.DesignerAnna Palleschitz",chair,00290
EKENÄSET,C:\Users\admin\Downloads\app_30688142\ekenaeset-armchair-jonsbyn-black__1109680_pe870147_s5.jpg,"10-year guarantee. Read about the terms in the guarantee brochure.Clean lines and supportive comfort, regardless if you’re reading, socialising with friends or just relaxing for a moment.The elegant, fixed cover has a perfect fit that will last over time. You can choose from different covers and find one that suits you and your home.You will sit stable and steady for years to come since the frame is made of hardwearing solid wood. You also enjoy a relaxed sitting position thanks to the angled backrest.Each armchair has a unique expression since the wooden frame is first stained in a dark-brown tone and then covered with clear lacquer that makes the wood’s natural grains visible.High-resilience foam in the seat and back makes the armchair regain its shape when you stand up, and it’s complemented with zigzag springs in the seat and supportive fabric in the back for a firm comfort.The tall legs in solid wood make it easy to vacuum or reach things hiding under the armchair to avoid clutter.DesignerIKEA of Sweden",chair,00291
ODGER,C:\Users\admin\Downloads\app_30688142\odger-chair-anthracite__0739669_pe741828_s5.jpg,"No tools are required to assemble the chair, you just click it together with a simple mechanism under the seat.Have a seat and stay a while - the friendly, embracing curves and flexy material make this chair nice and comfy.The wood fibre/plastic composite material gives the chair a textured, matte surface that is soft and inviting to the touch.Viewed from afar, the wood fibres blend into the surface, up close they become an interesting design feature that catches the eye.DesignerJ Löfgren/J Pettersson",chair,00292
TULLSTA,C:\Users\admin\Downloads\app_30688142\tullsta-armchair-nordvalla-medium-grey__0386142_pe559174_s5.jpg,"The included cushion can be used for lumbar support.Slim lines, easy to place.The cover is easy to keep clean since it is removable and can be machine washed.A range of coordinated covers makes it easy for you to give your furniture a new look.10 year guarantee. Read about the terms in the guarantee brochure.DesignerIKEA of Sweden",chair,00293
ALEFJÄLL,C:\Users\admin\Downloads\app_30688142\alefjaell-office-chair-grann-golden-brown__0724709_pe734591_s5.jpg,"10 year guarantee. Read about the terms in the guarantee brochure.The padded armrests provide good support and comfort for your arms.Suitable for business use.This ergonomic office chair has lots of functions that allow you to easily adapt the chair to your body.Synchronised tilt mechanism allows the chair to move with you. The backrest moves more than the seat when you lean back, so torso/hips open up. This improves circulation and keeps energy levels up.Adjustable seat depth enables proper back support and even weight distribution across the seat cushion. This prevents circulation from being cut off at the knees and reduces knee pressure.Adjustable lumbar support helps maintain the correct posture while sitting which reduces strain on muscles on your lower back.Height-adjustable seat allows you to adjust the height so that back and legs are at a 90° angle.A safety function locks the castors when no one is sitting in the chair and keeps it securely in place when you stand up.The castors are designed to provide ease of movement and maneuverability on both carpeted and hard floors as well as on uneven surfaces.With automatic tilt tension, your body weight determines how much resistance the backrest offers. This counter-pressure helps you keep an active posture in your chair.As you recline, the synchronised tilt mechanism allows feet to stay on the floor while your gaze remains straight ahead. Your chest stretches without adding pressure on thighs, improving circulation.Backrest can be adjusted to provide support in all the right places and helping your body to maintain a naturally good posture.GRANN cover is made of grain leather which is a very high-quality leather. As it ages it becomes softer and develops a darker tone and fine patina.DesignerFrancis Cayouette",chair,00294
BJÖRKBERGET,C:\Users\admin\Downloads\app_30688142\bjoerkberget-swivel-chair-idekulla-beige__0955769_pe804114_s5.jpg,"The cover is easy to keep clean since it is removable and can be machine washed, while the perfect fit makes it look just as neat as a fixed cover.Adjustable feet make it stand steady also on uneven floors.Details such as visible stitches in the seat and backrest give the chair an elaborate look and a touch of retro style.Generous padding in the seat and backrest makes this chair a great choice if you want to sit comfortably at the desk.With its swivel function and adjustable seat, you can easily find a working position that suits you and feels comfy. The chair is also easy to store when not in use since it has no armrests.The practical and comfortable swivel function allows you to easily get up from the desk or makeup table without moving the chair.Neat, compact and easy to place – even in small rooms. Complements HAUGA and LOMMARP desks in both size and style.DesignerMia Cullin",chair,00295
BLECKBERGET,C:\Users\admin\Downloads\app_30688142\bleckberget-swivel-chair-idekulla-dark-grey__0814728_pe776013_s5.jpg,"The safety castors have a pressure-sensitive brake mechanism that keeps the chair in place when you stand up, and releases automatically when you sit down.Generous padding in the seat and backrest makes this chair a great choice if you want to sit comfortably at the desk.With its swivel function and adjustable seat, you can easily find a working position that suits you and feels comfy. The chair is also easy to store when not in use since it has no armrests.The practical and comfortable swivel function allows you to easily get up from the desk without moving the chair.Neat, compact and easy to place – even in small rooms. Complements LAGKAPTEN/MITTBACK desk in both size and style.DesignerFrancis Cayouette",chair,00296
IVAR,C:\Users\admin\Downloads\app_30688142\ivar-chair-pine__0728155_pe736115_s5.jpg,DesignerIKEA of Sweden,chair,00297
MÅRENÄS,C:\Users\admin\Downloads\app_30688142\marenaes-chair-with-armrests-black-gunnared-beige__1182861_pe897321_s5.jpg,"After lively meals, it's nice to know that you can easily pull the chair cover off and machine wash it.The chair cover comes in one piece and fixes in place with hook-and-loop fasteners so you can easily pull it off and put it back on again.Additional chair covers are available in different colours for quick and easy updates, so you can always enjoy a chair that looks fresh and stylish without having to buy a new one.The chair cover is made of dope-dyed Gunnared fabric in polyester. It is a durable fabric with a wool-like feel, a warm look and a two-toned melange effect.Dine in style and comfort. This fully upholstered chair with armrests is perfect for long meals, spending precious moments with family and friends or for indulging in some relaxing me-time.With sofa-comfort feel, this chair can also serve as cosy extra seating in your bedroom, hallway, living room or wherever you would like a comfy spot to relax that doesn’t take up too much space.Seat feels soft and resilient thanks to plenty of padding and a sinuous/zig-zag spring bottom - like those often used in sofas.Padded armrests offer comfy support for your arms and are at just the right height in the front to fit under the table, allowing you to sit closer while eating.",chair,00298
LISABO,C:\Users\admin\Downloads\app_30688142\lisabo-chair-black-tallmyra-black-grey__1243670_pe920712_s5.jpg,"The cover is easy to keep clean as it is removable and machine washable.Ash-veneer and solid birch creates a warm, natural feeling in your room.Ash is a strong hardwood material with a beautiful grain pattern. As it ages the colour deepens moderately towards a deep straw colour.For a coordinated look, combine with other ash-veneer finish products in the LISABO series.A sturdy and comfortable chair that is well-suited for all types of activities around the table.DesignerK Hagberg/M Hagberg",chair,00299
JANINGE,C:\Users\admin\Downloads\app_30688142\janinge-chair-white__0728156_pe736116_s5.jpg,"You can stack the chairs, so they take less space when you're not using them.You can start using the chair immediately because it is ready assembled.DesignerJohn/Jonas/Petrus/Paul/Caroline",chair,00300
KOLON,C:\Users\admin\Downloads\app_30688142\kolon-floor-protector__0292207_pe425129_s5.jpg,Protects flooring against wear and dirt.DesignerIKEA of Sweden,chair,00301
POÄNG,C:\Users\admin\Downloads\app_30688142\poaeng-armchair-and-footstool-birch-veneer-knisa-light-beige__1096006_pe864150_s5.jpg,"To sit even more comfortably and relaxed, you can use the armchair together with POÄNG footstool.Layer-glued bent birch frame gives comfortable resilience.A range of various seat cushions makes it easy to change the look of your POÄNG and your living room.The high back gives good support for your neck.The frame is made of layer-glued bent birch which is a very strong and durable material.10 year guarantee. Read about the terms in the guarantee brochure.Knisa cushion is made of a durable yet soft and smooth fabric.The cushion is designed with a discreet stitching detail on the side that gives it a characteristic look.",chair,00302
EBBALYCKE,C:\Users\admin\Downloads\app_30688142\ebbalycke-chair-idekulla-beige__1243346_pe920576_s5.jpg,"Dine in style and comfort. This upholstered chair is perfect for long meals, spending precious moments with family and friends or for indulging in some relaxing me-time.The chair stands firmly in place thanks to the metal underframe.Removable and washable seat cover makes this chair a good option for families with children.2 pockets on the back of the chair offer handy storage for things like tablets, mobile devices, remote controls and napkins.DesignerEbba Strandmark",chair,00303
EKTORP,C:\Users\admin\Downloads\app_30688142\ektorp-armchair-kilanda-light-beige__1242736_pe920364_s5.jpg,"The cover is easy to keep clean since it is removable and can be machine washed.The reversible back cushion of polyester fibre gives soft support for your back and two sides to wear.Seat cushions filled with high resilience foam and polyester fibre wadding give comfortable support for your body, and easily regain their shape when you get up.10 year guarantee. Read about the terms in the guarantee brochure.The Kilanda fabric with a melange effect is made of at least 90 percent recycled polyester and has a soft surface.",chair,00304
VEDBO,C:\Users\admin\Downloads\app_30688142\vedbo-high-back-armchair-gunnared-light-green__0949822_pe800039_s5.jpg,"10 year guarantee. Read about the terms in the guarantee brochure.The timeless design of VEDBO makes it easy to place in various room settings and match with other furniture.The high back panel gives you an embracing and private nook – even in an open-plan environment.VEDBO armchair is ideal when you want to relax in your own space in an open environment, yet still want the opportunity to socialise with others when you like.VEDBO comes in 3 different earthy colours, adding beauty to any room.DesignerFrancis Cayouette",chair,00305
TORPARÖ,C:\Users\admin\Downloads\app_30688142\torparoe-chair-in-outdoor-foldable-white-grey__1138961_pe880160_s5.jpg,"The materials in this outdoor furniture require minimal maintenance.Perfect for your balcony or other small spaces as it can be folded up and put away.The chair is durable and easy to care for, as it is made of powder-coated steel and plastic.The chair comes pre-assembled, so you can start using it immediately.DesignerOla Wihlborg",chair,00306
